Dan Arnold,JAX,2,1,0.5,8,0,0.026000000000000002,0,0,,0,0,0.0,All Dan Arnold red zone receiving plays
Tutu Atwell,LAR,2,1,0.5,3,0,0.03,1,0,0.0,0,0,0.026000000000000002,All Tutu Atwell red zone receiving plays
Saquon Barkley,NYG,2,0,0.0,0,0,0.051,1,0,0.0,0,0,0.05,All Saquon Barkley red zone receiving plays
John Bates,WAS,2,1,0.5,16,1,0.037000000000000005,0,0,,0,0,0.0,All John Bates red zone receiving plays
Mike Boone,DEN,2,1,0.5,2,0,0.040999999999999995,1,0,0.0,0,0,0.037000000000000005,All Mike Boone red zone receiving plays
Malcolm Brown,LAR,2,1,0.5,3,0,0.03,1,1,1.0,3,0,0.026000000000000002,All Malcolm Brown red zone receiving plays
Pharaoh Brown,CLE,2,1,0.5,5,0,0.028999999999999998,0,0,,0,0,0.0,All Pharaoh Brown red zone receiving plays
Grant Calcaterra,PHI,2,1,0.5,-2,0,0.043,0,0,,0,0,0.0,All Grant Calcaterra red zone receiving plays
Malik Davis,DAL,2,2,1.0,15,0,0.03,0,0,,0,0,0.0,All Malik Davis red zone receiving plays
J.K. Dobbins,BAL,2,1,0.5,1,1,0.028999999999999998,2,1,0.5,1,1,0.069,All J.K. Dobbins red zone receiving plays
Phillip Dorsett,HOU,2,0,0.0,0,0,0.03,1,0,0.0,0,0,0.04,All Phillip Dorsett red zone receiving plays
Greg Dulcich,DEN,2,1,0.5,11,1,0.040999999999999995,1,0,0.0,0,0,0.037000000000000005,All Greg Dulcich red zone receiving plays
D'Wayne Eskridge,SEA,2,1,0.5,3,0,0.03,1,0,0.0,0,0,0.037000000000000005,All D'Wayne Eskridge red zone receiving plays
Zach Gentry,PIT,2,1,0.5,2,0,0.036000000000000004,2,1,0.5,2,0,0.069,All Zach Gentry red zone receiving plays
Melvin Gordon,DEN,2,2,1.0,14,0,0.040999999999999995,1,1,1.0,8,0,0.037000000000000005,All Melvin Gordon red zone receiving plays
Ryan Griffin,CHI,2,1,0.5,2,0,0.054000000000000006,1,0,0.0,0,0,0.059000000000000004,All Ryan Griffin red zone receiving plays
C.J. Ham,MIN,2,2,1.0,7,0,0.02,2,2,1.0,7,0,0.038,All C.J. Ham red zone receiving plays
Darrell Henderson,LAR,2,1,0.5,7,0,0.03,0,0,,0,0,0.0,All Darrell Henderson red zone receiving plays
Parker Hesse,ATL,2,1,0.5,5,0,0.042,0,0,,0,0,0.0,All Parker Hesse red zone receiving plays
Zander Horvath,LAC,2,2,1.0,2,2,0.021,2,2,1.0,2,2,0.043,All Zander Horvath red zone receiving plays
Alec Ingold,MIA,2,2,1.0,15,1,0.032,0,0,,0,0,0.0,All Alec Ingold red zone receiving plays
DeSean Jackson,BAL,2,0,0.0,0,0,0.028999999999999998,0,0,,0,0,0.0,All DeSean Jackson red zone receiving plays
Brandon Johnson,DEN,2,1,0.5,1,1,0.040999999999999995,2,1,0.5,1,1,0.07400000000000001,All Brandon Johnson red zone receiving plays
Velus Jones,CHI,2,1,0.5,9,1,0.054000000000000006,1,1,1.0,9,1,0.059000000000000004,All Velus Jones red zone receiving plays
Brevin Jordan,HOU,2,0,0.0,0,0,0.03,0,0,,0,0,0.0,All Brevin Jordan red zone receiving plays
Kyle Juszczyk,SFO,2,2,1.0,3,1,0.033,2,2,1.0,3,1,0.067,All Kyle Juszczyk red zone receiving plays
Zonovan Knight,NYJ,2,2,1.0,9,0,0.032,0,0,,0,0,0.0,All Zonovan Knight red zone receiving plays
Marcedes Lewis,GNB,2,2,1.0,3,2,0.027000000000000003,2,2,1.0,3,2,0.063,All Marcedes Lewis red zone receiving plays
Quintin Morris,BUF,2,2,1.0,14,1,0.026000000000000002,1,1,1.0,0,0,0.028999999999999998,All Quintin Morris red zone receiving plays
Chris Myarick,NYG,2,2,1.0,5,1,0.051,1,1,1.0,1,1,0.05,All Chris Myarick red zone receiving plays
Dare Ogunbowale,HOU,2,0,0.0,0,0,0.03,1,0,0.0,0,0,0.04,All Dare Ogunbowale red zone receiving plays
Donald Parham,LAC,2,1,0.5,3,1,0.021,2,1,0.5,3,1,0.043,All Donald Parham red zone receiving plays
Dameon Pierce,HOU,2,2,1.0,5,1,0.03,1,1,1.0,3,1,0.04,All Dameon Pierce red zone receiving plays
James Proche,BAL,2,1,0.5,6,0,0.028999999999999998,1,1,1.0,6,0,0.034,All James Proche red zone receiving plays
Wan'Dale Robinson,NYG,2,1,0.5,5,1,0.051,1,1,1.0,5,1,0.05,All Wan'Dale Robinson red zone receiving plays
Richard Rodgers,LAC,2,0,0.0,0,0,0.021,2,0,0.0,0,0,0.043,All Richard Rodgers red zone receiving plays
Kyle Rudolph,TAM,2,1,0.5,8,1,0.021,1,1,1.0,8,1,0.02,All Kyle Rudolph red zone receiving plays
Laviska Shenault,CAR,2,2,1.0,11,0,0.053,0,0,,0,0,0.0,All Laviska Shenault red zone receiving plays
David Sills,NYG,2,2,1.0,18,0,0.051,1,1,1.0,5,0,0.05,All David Sills red zone receiving plays
Tre'Quan Smith,NOR,2,1,0.5,18,1,0.033,1,0,0.0,0,0,0.048,All Tre'Quan Smith red zone receiving plays
Equanimeous St. Brown,CHI,2,1,0.5,18,1,0.054000000000000006,0,0,,0,0,0.0,All Equanimeous St. Brown red zone receiving plays
Ian Thomas,CAR,2,2,1.0,9,0,0.053,0,0,,0,0,0.0,All Ian Thomas red zone receiving plays
Laquon Treadwell,SEA,2,2,1.0,6,0,0.03,0,0,,0,0,0.0,All Laquon Treadwell red zone receiving plays
Justin Watson,KAN,2,1,0.5,4,1,0.019,2,1,0.5,4,1,0.031,All Justin Watson red zone receiving plays
Derek Watt,PIT,2,2,1.0,2,1,0.036000000000000004,2,2,1.0,2,1,0.069,All Derek Watt red zone receiving plays
Trevon Wesco,CHI,2,1,0.5,3,0,0.054000000000000006,1,1,1.0,3,0,0.059000000000000004,All Trevon Wesco red zone receiving plays
Jordan Wilkins,IND,2,2,1.0,6,0,0.032,1,1,1.0,4,0,0.031,All Jordan Wilkins red zone receiving plays
Jamaal Williams,DET,2,2,1.0,5,0,0.023,1,1,1.0,3,0,0.024,All Jamaal Williams red zone receiving plays
Michael Woods,CLE,2,1,0.5,4,0,0.028999999999999998,1,0,0.0,0,0,0.033,All Michael Woods red zone receiving plays
Andre Baccellia,ARI,1,0,0.0,0,0,0.016,0,0,,0,0,0.0,All Andre Baccellia red zone receiving plays
David Bakhtiari,GNB,1,0,0.0,0,0,0.013999999999999999,1,0,0.0,0,0,0.031,All David Bakhtiari red zone receiving plays
Michael Bandy,LAC,1,1,1.0,4,0,0.01,0,0,,0,0,0.0,All Michael Bandy red zone receiving plays
Rashod Bateman,BAL,1,1,1.0,4,0,0.013999999999999999,1,1,1.0,4,0,0.034,All Rashod Bateman red zone receiving plays
Cole Beasley,BUF,1,0,0.0,0,0,0.013000000000000001,1,0,0.0,0,0,0.028999999999999998,All Cole Beasley red zone receiving plays
Blake Bell,KAN,1,1,1.0,17,1,0.009000000000000001,0,0,,0,0,0.0,All Blake Bell red zone receiving plays
David Bell,CLE,1,1,1.0,6,0,0.013999999999999999,0,0,,0,0,0.0,All David Bell red zone receiving plays
Raheem Blackshear,CAR,1,1,1.0,0,0,0.026000000000000002,1,1,1.0,0,0,0.059000000000000004,All Raheem Blackshear red zone receiving plays
Brandon Bolden,LVR,1,1,1.0,18,1,0.013999999999999999,0,0,,0,0,0.0,All Brandon Bolden red zone receiving plays
Jason Cabinda,DET,1,0,0.0,0,0,0.012,0,0,,0,0,0.0,All Jason Cabinda red zone receiving plays
Lawrence Cager,NYG,1,1,1.0,9,1,0.026000000000000002,1,1,1.0,9,1,0.05,All Lawrence Cager red zone receiving plays
Nick Chubb,CLE,1,1,1.0,2,1,0.013999999999999999,1,1,1.0,2,1,0.033,All Nick Chubb red zone receiving plays
Tyrie Cleveland,DEN,1,0,0.0,0,0,0.02,0,0,,0,0,0.0,All Tyrie Cleveland red zone receiving plays
Tevin Coleman,SFO,1,1,1.0,9,1,0.016,1,1,1.0,9,1,0.033,All Tevin Coleman red zone receiving plays
DeeJay Dallas,SEA,1,1,1.0,4,0,0.015,1,1,1.0,4,0,0.037000000000000005,All DeeJay Dallas red zone receiving plays
Josiah Deguara,GNB,1,1,1.0,9,0,0.013999999999999999,0,0,,0,0,0.0,All Josiah Deguara red zone receiving plays
Ben Ellefson,MIN,1,1,1.0,2,0,0.01,0,0,,0,0,0.0,All Ben Ellefson red zone receiving plays
Ezekiel Elliott,DAL,1,1,1.0,3,0,0.015,1,1,1.0,3,0,0.028999999999999998,All Ezekiel Elliott red zone receiving plays
Chris Evans,CIN,1,1,1.0,8,1,0.011000000000000001,1,1,1.0,8,1,0.028999999999999998,All Chris Evans red zone receiving plays
Anthony Firkser,ATL,1,0,0.0,0,0,0.021,1,0,0.0,0,0,0.036000000000000004,All Anthony Firkser red zone receiving plays
D'Onta Foreman,CAR,1,1,1.0,-4,0,0.026000000000000002,0,0,,0,0,0.0,All D'Onta Foreman red zone receiving plays
Kenny Golladay,NYG,1,0,0.0,0,0,0.026000000000000002,1,0,0.0,0,0,0.05,All Kenny Golladay red zone receiving plays
Troy Hairston,HOU,1,0,0.0,0,0,0.015,1,0,0.0,0,0,0.04,All Troy Hairston red zone receiving plays
N'Keal Harry,CHI,1,1,1.0,17,1,0.027000000000000003,0,0,,0,0,0.0,All N'Keal Harry red zone receiving plays
Jamycal Hasty,JAX,1,1,1.0,9,0,0.013000000000000001,1,1,1.0,9,0,0.031,All Jamycal Hasty red zone receiving plays
Peyton Hendershot,DAL,1,1,1.0,2,1,0.015,1,1,1.0,2,1,0.028999999999999998,All Peyton Hendershot red zone receiving plays
Justin Herbert,LAC,1,1,1.0,-2,0,0.01,1,1,1.0,-2,0,0.022000000000000002,All Justin Herbert red zone receiving plays
Khalil Herbert,CHI,1,1,1.0,-2,0,0.027000000000000003,0,0,,0,0,0.0,All Khalil Herbert red zone receiving plays
Cody Hollister,TEN,1,1,1.0,5,0,0.018000000000000002,1,1,1.0,5,0,0.042,All Cody Hollister red zone receiving plays
Travis Homer,SEA,1,1,1.0,18,1,0.015,0,0,,0,0,0.0,All Travis Homer red zone receiving plays
Brycen Hopkins,LAR,1,1,1.0,11,0,0.015,0,0,,0,0,0.0,All Brycen Hopkins red zone receiving plays
Keaontay Ingram,ARI,1,1,1.0,-1,0,0.016,0,0,,0,0,0.0,All Keaontay Ingram red zone receiving plays
Tony Jones,NOR,1,1,1.0,5,0,0.016,0,0,,0,0,0.0,All Tony Jones red zone receiving plays
Joshua Kelley,LAC,1,1,1.0,8,0,0.01,0,0,,0,0,0.0,All Joshua Kelley red zone receiving plays
Tom Kennedy,DET,1,0,0.0,0,0,0.012,1,0,0.0,0,0,0.024,All Tom Kennedy red zone receiving plays
Ko Kieft,TAM,1,1,1.0,5,1,0.01,1,1,1.0,5,1,0.02,All Ko Kieft red zone receiving plays
Charlie Kolar,BAL,1,0,0.0,0,0,0.013999999999999999,1,0,0.0,0,0,0.034,All Charlie Kolar red zone receiving plays
Tyler Mabry,SEA,1,1,1.0,7,1,0.015,1,1,1.0,7,1,0.037000000000000005,All Tyler Mabry red zone receiving plays
Chris Manhertz,JAX,1,1,1.0,3,0,0.013000000000000001,0,0,,0,0,0.0,All Chris Manhertz red zone receiving plays
Trey McBride,ARI,1,1,1.0,4,1,0.016,1,1,1.0,4,1,0.036000000000000004,All Trey McBride red zone receiving plays
Ray-Ray McCloud,SFO,1,1,1.0,8,1,0.016,1,1,1.0,8,1,0.033,All Ray-Ray McCloud red zone receiving plays
Lance McCutcheon,LAR,1,0,0.0,0,0,0.015,0,0,,0,0,0.0,All Lance McCutcheon red zone receiving plays
Denzel Mims,NYJ,1,1,1.0,12,0,0.016,0,0,,0,0,0.0,All Denzel Mims red zone receiving plays
Elijah Mitchell,SFO,1,1,1.0,-1,0,0.016,1,1,1.0,-1,0,0.033,All Elijah Mitchell red zone receiving plays
James Mitchell,DET,1,1,1.0,3,1,0.012,1,1,1.0,3,1,0.024,All James Mitchell red zone receiving plays
Ty Montgomery,NWE,1,1,1.0,6,1,0.022000000000000002,1,1,1.0,6,1,0.036000000000000004,All Ty Montgomery red zone receiving plays
Skyy Moore,KAN,1,1,1.0,2,0,0.009000000000000001,1,1,1.0,2,0,0.016,All Skyy Moore red zone receiving plays
Stanley Morgan,CIN,1,0,0.0,0,0,0.011000000000000001,1,0,0.0,0,0,0.028999999999999998,All Stanley Morgan red zone receiving plays
Jalen Nailor,MIN,1,1,1.0,5,0,0.01,0,0,,0,0,0.0,All Jalen Nailor red zone receiving plays
Albert Okwuegbunam,DEN,1,1,1.0,3,0,0.02,1,1,1.0,3,0,0.037000000000000005,All Albert Okwuegbunam red zone receiving plays
Gunner Olszewski,PIT,1,1,1.0,8,0,0.018000000000000002,1,1,1.0,8,0,0.034,All Gunner Olszewski red zone receiving plays
Isiah Pacheco,KAN,1,1,1.0,9,0,0.009000000000000001,0,0,,0,0,0.0,All Isiah Pacheco red zone receiving plays
Zach Pascal,PHI,1,1,1.0,1,0,0.021,0,0,,0,0,0.0,All Zach Pascal red zone receiving plays
Dezmon Patmon,IND,1,0,0.0,0,0,0.016,1,0,0.0,0,0,0.031,All Dezmon Patmon red zone receiving plays
Rashaad Penny,SEA,1,1,1.0,4,0,0.015,0,0,,0,0,0.0,All Rashaad Penny red zone receiving plays
Byron Pringle,CHI,1,1,1.0,4,1,0.027000000000000003,1,1,1.0,4,1,0.059000000000000004,All Byron Pringle red zone receiving plays
Jalen Reagor,MIN,1,1,1.0,1,1,0.01,1,1,1.0,1,1,0.019,All Jalen Reagor red zone receiving plays
Patrick Ricard,BAL,1,1,1.0,12,0,0.013999999999999999,0,0,,0,0,0.0,All Patrick Ricard red zone receiving plays
Ronnie Rivers,LAR,1,1,1.0,14,0,0.015,0,0,,0,0,0.0,All Ronnie Rivers red zone receiving plays
Brian Robinson,WAS,1,1,1.0,14,1,0.019,0,0,,0,0,0.0,All Brian Robinson red zone receiving plays
Amari Rodgers,GNB,1,0,0.0,0,0,0.013999999999999999,0,0,,0,0,0.0,All Amari Rodgers red zone receiving plays
Drew Sample,CIN,1,1,1.0,2,0,0.011000000000000001,0,0,,0,0,0.0,All Drew Sample red zone receiving plays
Rashid Shaheed,NOR,1,1,1.0,8,0,0.016,0,0,,0,0,0.0,All Rashid Shaheed red zone receiving plays
Sterling Shepard,NYG,1,0,0.0,0,0,0.026000000000000002,0,0,,0,0,0.0,All Sterling Shepard red zone receiving plays
Steven Sims,PIT,1,0,0.0,0,0,0.018000000000000002,0,0,,0,0,0.0,All Steven Sims red zone receiving plays
Ihmir Smith-Marsette,CHI,1,0,0.0,0,0,0.027000000000000003,1,0,0.0,0,0,0.059000000000000004,All Ihmir Smith-Marsette red zone receiving plays
Jeff Smith,NYJ,1,0,0.0,0,0,0.016,0,0,,0,0,0.0,All Jeff Smith red zone receiving plays
Keith Smith,ATL,1,0,0.0,0,0,0.021,1,0,0.0,0,0,0.036000000000000004,All Keith Smith red zone receiving plays
Jack Stoll,PHI,1,0,0.0,0,0,0.021,1,0,0.0,0,0,0.05,All Jack Stoll red zone receiving plays
Jalen Tolbert,DAL,1,1,1.0,4,0,0.015,0,0,,0,0,0.0,All Jalen Tolbert red zone receiving plays
Samori Toure,GNB,1,1,1.0,2,0,0.013999999999999999,0,0,,0,0,0.0,All Samori Toure red zone receiving plays
Cole Turner,WAS,1,0,0.0,0,0,0.019,1,0,0.0,0,0,0.036000000000000004,All Cole Turner red zone receiving plays
DJ Turner,LVR,1,0,0.0,0,0,0.013999999999999999,0,0,,0,0,0.0,All DJ Turner red zone receiving plays
C.J. Uzomah,NYJ,1,1,1.0,1,1,0.016,1,1,1.0,1,1,0.036000000000000004,All C.J. Uzomah red zone receiving plays
Nick Vannett,NYG,1,1,1.0,12,0,0.026000000000000002,0,0,,0,0,0.0,All Nick Vannett red zone receiving plays
Kenneth Walker,SEA,1,1,1.0,4,0,0.015,0,0,,0,0,0.0,All Kenneth Walker red zone receiving plays
Jonathan Ward,TEN,1,1,1.0,4,0,0.018000000000000002,0,0,,0,0,0.0,All Jonathan Ward red zone receiving plays
Mitchell Wilcox,CIN,1,1,1.0,12,1,0.011000000000000001,0,0,,0,0,0.0,All Mitchell Wilcox red zone receiving plays
Darrel Williams,ARI,1,0,0.0,0,0,0.016,1,0,0.0,0,0,0.036000000000000004,All Darrel Williams red zone receiving plays
Kyren Williams,LAR,1,0,0.0,0,0,0.015,0,0,,0,0,0.0,All Kyren Williams red zone receiving plays
Zach Wilson,NYJ,1,1,1.0,2,1,0.016,1,1,1.0,2,1,0.036000000000000004,All Zach Wilson red zone receiving plays
